{
  "schemaVersion": "1.0",
  "contractId": "travel-context-backend-correction-002",
  "change": "add-travel-context-and-account-preferences",
  "stage": "BACKEND_IMPLEMENTATION",
  "role": "backend_engineer",
  "taskIds": [
    "2.4",
    "3.3",
    "3.4",
    "4.2",
    "4.5"
  ],
  "parentContractId": "travel-context-backend-003",
  "reviewFingerprint": "sha256:4d0d23cc4a186b43f7da3dc4d288beac667e973bb22e30250d7d7686017c2596",
  "findingIds": [
    "EXP-BE-NEW-ACCOUNT-PREFERENCES-001"
  ],
  "authoritativeInputs": [
    {
      "path": "openspec/changes/add-travel-context-and-account-preferences/handoffs/travel-context-experience-review-008/reviews/travel-context-experience-review-002.json",
      "fingerprint": "sha256:4d0d23cc4a186b43f7da3dc4d288beac667e973bb22e30250d7d7686017c2596"
    },
    {
      "path": "openspec/changes/add-travel-context-and-account-preferences/design.md",
      "fingerprint": "sha256:757829f1f7843588e60d6e2373ae2090951f8096ecd4d405413fb2acef5086c7"
    },
    {
      "path": "openspec/changes/add-travel-context-and-account-preferences/specs/backend-account-preferences/spec.md",
      "fingerprint": "sha256:11c1a56ee51ac71dac33ffc66ee1bcbfb0681dd83214714e3a29b13a6454fb83"
    }
  ],
  "allowedWritePaths": [
    "backend/src/main/java/com/heness/project/account/infrastructure/persistence/MybatisAuthenticationRepository.java",
    "backend/src/main/java/com/heness/project/account/infrastructure/persistence/AccountPreferencesMapper.java",
    "backend/src/main/java/com/heness/project/account/infrastructure/persistence/TravelContextMapper.java",
    "backend/src/test/java/com/heness/project/account/infrastructure/persistence/MySqlAuthenticationPersistenceTests.java",
    "backend/src/test/java/com/heness/project/account/infrastructure/persistence/MySqlAccountPreferencesTests.java"
  ],
  "forbiddenWritePaths": [
    "frontend/",
    "openspec/",
    "docs/designs/chinamate-auth.pen",
    ".codex/",
    "backend/src/main/resources/db/migration/"
  ],
  "expectedFixes": [
    "新注册账号在账号创建持久化事务内同步初始化默认 zh-CN account_preferences 与 version 0 空 account_travel_context",
    "新注册账号首次读取旅行上下文返回 200 和稳定空表示，不抛出缺行异常",
    "补充真实 MySQL 注册初始化、旅行读取及事务原子性回归测试"
  ],
  "acceptanceCriteria": [
    "EXP-BE-NEW-ACCOUNT-PREFERENCES-001 的 requiredVerification 全部具备测试或真实场景证据",
    "既有账号和 migration 回填行为不回归",
    "初始化与账号创建处于同一事务，任一步失败均不留下半成品账号或偏好数据",
    "不引入 Spring JDBC、新依赖、SQL 注解或 schema 变更",
    "目标测试、ArchitectureRulesTests、完整后端测试与 MySQL 8.4 专项通过"
  ],
  "retestPlan": [
    "cd backend && ./mvnw -Dtest=MySqlAuthenticationPersistenceTests,MySqlAccountPreferencesTests test",
    "cd backend && ./mvnw -Dtest=ArchitectureRulesTests test",
    "cd backend && ./mvnw test",
    "加载根 .env 后运行 MySQL 8.4 注册初始化与旅行上下文专项",
    "由原 experience_reviewer 使用新注册账号复核旅行上下文和账号安全页"
  ],
  "userGates": [
    {
      "name": "SPEC_CONFIRMATION",
      "status": "SATISFIED",
      "evidenceRefs": [
        "user-message:确认采用建议的会话策略并继续实现"
      ]
    }
  ],
  "gitGates": [
    {
      "name": "GIT_WRITE",
      "status": "NOT_APPLICABLE",
      "evidenceRefs": []
    }
  ],
  "status": "ISSUED",
  "persistedBy": "main_agent"
}
